{
  "schema_version": "1.1",
  "project": {
    "name": "安民街(安和段)",
    "renewal_type": "urban_renewal"
  },
  "land": {
    "site_area_sqm": 1632.04,
    "plaza_area_sqm": 0.0,
    "far": 2.8,
    "bonus_ratio": 0.5,
    "bonus_breakdown": {
      "更新基本": 0.5
    },
    "tdr_transfer_sqm": 913.94
  },
  "building": {
    "public_ratio": 0.34,
    "stair_hall_exempt_pct": 5,
    "balcony_exempt_pct": 10,
    "unit_count": 111
  },
  "owners": [],
  "finance": {
    "residential_price": 65.0,
    "shop_area": 276.49,
    "shop_price": 100.0,
    "parking_count": 105,
    "parking_price": 230.43,
    "construction_price": 22.0
  },
  "result": {
    "baseline_far": 4569.71,
    "allow_floor_area": 7768.51,
    "used_floor_area": 7768.51,
    "remaining_floor_area": -0.0,
    "stair_exempt_cap": 1165.28,
    "balcony_exempt_area": 659.15,
    "saleable_area": 3901.29,
    "efficiency_ratio": 1.66,
    "total_sales": 287456.0,
    "shared_cost": 156184.0,
    "shared_cost_ratio": 0.5433,
    "owner_return_value": 131272.0,
    "owner_return_ratio": 0.4567,
    "return_rate": 0.8405,
    "pre_renewal_value": 66648.0,
    "value_multiple": 1.97,
    "warnings": [
      {
        "code": "VOLUME_EXCEEDED",
        "level": "error",
        "message": "容積超出允建 0.00 m²，需調整設計",
        "field": "remaining_floor_area"
      },
      {
        "code": "SHARED_COST_HIGH",
        "level": "warn",
        "message": "共負比 54.3% 高於合理區間上限 50%",
        "field": "shared_cost_ratio"
      }
    ],
    "computed_at": "2026-07-01T00:00:00+00:00",
    "core_version": "0.2.0"
  }
}